key,0,1,2,3,4,5,6,7,8,9,10,11,12,13
#,Level,MinLevel,MaxLevel,Emote,MinTime,MaxTime,PlaceName,Icon{List},Icon{Discovered},Name,Impression,Description,Icon{Undiscovered},IsInitial
int32,Level,int32,byte,Emote,uint16,uint16,PlaceName,Image,Image,str,str,str,Image,bit&01
2162688,4876856,0,0,22,800,1159,27,81501,81001,"Quais du barracuda","Avant de déjeuner, les gourmets limséens savent d'où regarder les trois navires de guerre aux voiles écarlates qui sont le fleuron de la marine du Maelstrom.","Ce lieu est celui où sont amarrés les navires de guerre du Maelstrom. Son accès est interdit au public pour des raisons de sécurité, mais les curieux savent d'où admirer la puissante armada, notamment son célèbre vaisseau étendard, le Triomphe.",81451,True
2162689,4876859,0,0,22,1800,459,27,81502,81002,"Astalicia","Le soir, les pirates éméchés aiment se tenir au bout d'un espar pour admirer le port sous un ciel étoilé... avant d'attraper un badaud pour s'amuser à le pendre.","Cet imposant galion appartient à l'équipage pirate des Bourreaux. Bien qu'il soit enregistré comme navire marchand étranger, tout Limsa Lominsa sait qu'il est la propriété de l'illustre Hyllfyr et sert de repaire aux corsaires et autres coupe-jarrets.",81451,True
2162690,4876905,0,0,58,500,759,30,81503,81003,"Stèle du chant marin","Les pêcheurs superstitieux ne manquent jamais d'aller prier à l'entrée d'une grotte pour leurs camarades disparus avant de partir en mer, lorsque la pluie joue un requiem pour leurs âmes.","Érigée à la mémoire des marins disparus, cette stèle porte l'inscription “Je suis la vague qui porte, je suis le vent qui guide. Je suis l'étoile qui brille dans la nuit, je suis le calme blanc du matin. Je suis né dans la mer, et c'est en elle que je mourrai...”",81451,True
2162691,4876907,0,0,22,1200,1659,30,81504,81004,"Ascenciel","Lorsqu'ils prennent une pause l'après-midi, les convoyeurs noscéens aiment admirer les ballons qui transportent les marchandises au-dessus de la mer.","Cette installation gérée par les convoyeurs limséens permet de transporter les mar<SoftHyphen/>chan<SoftHyphen/>di<SoftHyphen/>ses à l'aide de palans et de ballons le long de La Descente, un précipice apparu lors du septième fléau au beau milieu de la plaine de la Noscea centrale.",81451,True
2162692,4876912,0,0,22,800,1159,30,81505,81005,"Route orientale de la Thagran","Lorsqu'ils se sentent d'humeur grisâtre, les casaques jaunes n'hésitent pas à monter sur une palissade pour admirer la Noscea avant le milieu de la journée.","Cet axe de circulation, qui relie la Noscea centrale à la Noscea orientale, a reçu le nom de Guy la Thagran, un navigateur élézen qui s'est illustré en explorant l'île de Vylbrand en compagnie de son camarade Jean de Nevelle lorsque le Galadion s'y est échoué.",81451,True
2162693,4876920,0,0,22,1800,459,31,81508,81008,"Atolls de sel","L'un des avantages de la vie de gardien de phare, c'est de pouvoir se tenir sur le bord du promontoire pour observer la plage, lorsque la nuit tombe.","Un fragment de Dalamud tombé lors du Fléau a libéré l'éther du sol, provoquant la formation d'un imposant cristal corrompu qui, à son tour, a causé l'agglomération des sels de mer projetés vers le ciel sous la force de l'impact.",81451,True
2162694,4876921,0,0,22,500,759,31,81509,81009,"Métairie du Coq rouge","La vie de métayer requiert de se lever tôt, mais c'est aussi la chance d'admirer les baraques et les clôtures prendre forme dans la brume matinale, debout sur les tuiles.","Outre ses potagers expérimentaux, cette ex<SoftHyphen/>ploi<SoftHyphen/>ta<SoftHyphen/>tion fait aussi l'élevage de dodos et de moutons. Son nom viendrait d'un combat de coqs, un rouge et un blanc, qui aurait dégénéré en bagarre et fini avec les deux volailles et les spectateurs couverts de sang.",81451,True
2162695,4876926,0,0,22,500,759,33,81513,81013,"Phare des Brasseurs","L'œil qui veille sur les navires la nuit est celui qui a la meilleure vue sur la baie, lorsque les premiers rayons de soleil font leur apparition.","Bâti pour remplacer la tour du Martinet détruite lors du Fléau, ce phare tire son nom du fait qu'il guide les navires passant par Port-aux-Ales. Il permet aussi d'observer les murs qui doivent protéger la côte contre les raz-de-marée du Primordial Léviathan.",81451,True
2162696,4868036,0,0,22,1200,1659,39,81527,81027,"Guilde des tanneurs","Le travail du cuir est une telle fierté à Gridania que les enfants grimpent souvent sur les cadres de séchage pour admirer les tanneurs à l'ouvrage, lorsqu'il fait gris l'après-midi.","Le métier de la tannerie est une des plus grandes fiertés de Gridania. Pratiquant leur artisanat dans le respect des matériaux que leur fournit la forêt, les membres de cette guilde ont créé leur propre marque de produits de haute qualité, Les Atours de Fen-Yll.",81452,True
2162697,4876928,0,0,22,1800,459,39,81528,81028,"Chutes de l'Apkallu","Les garnements gridaniens sont bien agiles. Trompant la vigilance de leurs parents, ils vont se percher sur les lampadaires pour admirer le reflet des étoiles dans l'eau vive.","Appréciées pour le son rassérénant qu'elles produisent, ces chutes d'eau tirent leur nom d'une tentative échouée d'élevage d'apkallus. À la fin de la 6e ère astrale, le sage Louisoix s'y rendait souvent pour méditer lors de ses visites à Gridania.",81452,True
2162698,4877070,0,0,50,1200,1659,54,81530,81030,"Ranch de Brancharquée","Il n'est pas donné à tout le monde de voir les Mogs, mais il y en a un grand que chacun peut admirer tranquillement par un bel après-midi, en s'asseyant sur une souche.","Ce ranch est géré par la compagnie des Montures Mog. Les chocobos y sont élevés sous les in<SoftHyphen/>struc<SoftHyphen/>tions d'un dresseur venu d'Ishgard, une nation dont les destriers à plumes font la fierté. Le ballon à têtes de Mog à l'entrée est un célèbre symbole de l'endroit.",81452,True
2162699,4877071,0,0,58,800,1159,55,81535,81035,"Sanctuaire des Douze","Lorsque la lumière matinale vient faire étinceler l'eau, alors l'air se remplit d'une atmosphère bénie qui force même les moins croyants à prier au seuil de la béatitude.","Bâti pour obtenir la protection des Douze contre les famines et les épidémies qui ont suivi la grande glaciation, ce vieil édifice longtemps délaissé a été restauré après le septième fléau avec l'aide des Gridaniens pour recevoir de nouveau la faveur des Dieux.",81452,True
2162700,4877072,0,0,22,1800,459,55,81536,81036,"Le Refuge","Même sans savoir voler, les humains peuvent, avec un peu d'agilité, grimper sur les branches pour admirer le paysage depuis le toit naturel d'une demeure sylphe, par une belle nuit.","Ayant fui leurs semblables, les Sylphes qui vivent ici sont opposés à l'invocation du Primordial Ramuh. Grâce à leur magie, ces êtres volants savent modeler les végétaux pour créer d'étranges habitations suspendues aux arbres, bien à l'abri des dangers.",81452,True
2162701,4877073,0,0,31,500,759,51,81546,81046,"Promenade royale","Il n'est pas rare de voir des lève-tôt profiter d'un beau ciel dégagé pour visiter la ville. Certains s'amusent à se tenir sur une des trois plaques argentées au pied d'un certain escalier, et à imiter le salut des sentinelles qui font la relève. Ah, ces touristes...","L'allée du district politique d'Ul'dah qui permet d'accéder au palais de la famille royale. Les casques d'argent sont chargés de sa sur<SoftHyphen/>veil<SoftHyphen/>lan<SoftHyphen/>ce. À l'époque où le pouvoir des sultans était encore important, l'endroit était toujours animé par la présence des suppliants attendant une audience. De nos jours, il sert surtout de lieu de promenade aux riches seigneurs de la Cité.",81453,True
2162702,4877074,0,0,22,1200,1659,51,81547,81047,"Cour dorée","Les jeunes d'aujourd'hui ne savent plus quoi inventer pour s'occuper les jours où la pluie menace. La dernière fureur est d'aller se percher sur des endroits incongrus. Le lampadaire à l'est de la fontaine est très apprécié des plus audacieux, qui aiment scruter les environs de haut.","La magnifique fontaine de cette place au centre d'Ul'dah attire les citadins en quête d'un peu de fraîcheur durant les journées torrides. L'endroit était autrefois une salle de bal de la famille royale, mais son entretien étant devenu trop coûteux pour un trésor s'amenuisant d'année en année, il a été récemment cédé à la ville.",81453,True
2162703,4877077,0,0,22,1800,459,42,81548,81048,"Ul'dah","Le ""joyau du désert"" est une vision magique la nuit. La lumière des étoiles pâlit devant la sienne. Le meilleur point de vue pour l'admirer serait en haut de l'échafaudage des sources de Nophica.","La capitale marchande qui se dresse dans les terres désolées du Thanalan. Protégée par de hauts murs, seuls les plus grands bâtiments sont visibles de loin. Parce que leurs dômes brillent de mille feux sous la lumière du soleil, et que la ville regorge de richesses, elle est surnommée le joyau du désert.",81453,True
2162704,4877078,0,0,22,800,1159,43,81551,81051,"Vestiges de Sil'dih","Un voyageur a raconté qu'il a failli perdre la vie en tombant d'une falaise à cause d'un brouillard matinal. Un rebord plus bas l'a heureusement sauvé, et une fois sa frayeur passée, il a pu admirer les ruines d'une Cité disparue.","Les ruines de l'ancienne Cité de Sil'dih. Elle a été détruite par les Uldiens il y a quatre cents ans à l'issue d'une longue guerre, et en l'espace d'un siècle a été presque entièrement ensevelie par le sable du Thanalan. L'emplacement actuel d'Ul'dah empiète partiellement sur celui de Sil'dih.",81453,True
2162705,4877079,0,0,9,1700,1759,44,81554,81054,"Le géant solitaire","Les voyageurs qui s'abritent de la pluie dans un petit bosquet sont souvent touchés par la vision du corps sans vie d'un géant moussu. Il semble si seul lorsque la nuit approche. On aurait presque envie de le consoler...","Les Uldiens pensent que ce goobbue du Coerthas a dû fuir paniqué lors du septième fléau, et a fini par mourir d'épuisement peu après avoir atteint le Thanalan. Cela ex<SoftHyphen/>pli<SoftHyphen/>que<SoftHyphen/>rait l'abondance de végétation originaire de Sombrelinceul ayant poussé près du cadavre<Indent/>: de nombreuses graines se sont pro<SoftHyphen/>ba<SoftHyphen/>ble<SoftHyphen/>ment accrochées à lui durant son passage dans la forêt. ",81453,True
2162706,4877081,0,0,22,800,1159,44,81555,81055,"La Cité invisible","Certains aventuriers n'ayant pas peur des hauteurs recommandent d'admirer le matin les ruines d'une antique Cité, du haut d'un morceau de route brisé. La vue en vaudrait la peine d'après eux, même par temps couvert.","La chute de morceaux de Dalamud au Mur incandescent a créé une énorme crevasse, révélant des vestiges majestueux. Des recherches ont bien entendu été menées et les historiens pensent qu'il s'agirait de la tombe de Lalafuto IV, dirigeant de l'ancienne cité de Belah'dia.",81453,True
2162707,4877082,0,0,58,500,759,44,81556,81056,"Le Viaduc","Quand le temps est clair, rien de tel qu'une petite prière au bout d'une passerelle surplombant une crevasse sans fond pour bien commencer la journée !","Ce pont a été construit afin de relier le Thanalan à la forêt de Sombrelinceul. Comme il s'agit d'une route commerciale essentielle entre Gridania et Ul'dah, le régiment de l'Orchidée des lames de cuivre y est stationné en permanence. Les archéologues étudiant les ruines de la Cité invisible ont également un camp à proximité. ",81453,True
2162708,4877083,0,0,22,1200,1659,30,81506,81006,"Canyon des Chuchotements","Le soleil rayonne parfois fort sur la Noscea centrale, mais les paysans locaux connaissent un endroit à l'ombre où se désaltérer en observant l'eau tomber.","Prenant sa source près du volcan d'O'Ghomoro, la rivière de Nym a creusé cette gorge au cours du temps. Le doux murmure des nombreuses chutes d'eau et l'abri que prodigue cet endroit contre le soleil en font le lieu préféré des Limséens pour boire au frais.",81451,False
2162709,4877084,0,0,22,500,759,30,81507,81007,"Vergers d'Estival","Être maraîcher n'a rien de palpitant quand on a vécu le sabre au clair, même si on peut utiliser une lampe en guise de nid-de-corbeau pour faire la vigie dans une salle.","Cette plantation, où collaborent anciens pirates et maraîchers de métier, a été créée dans le cadre de la politique de développement du territoire de l'amirale Bloefhiswyn. La rivière des requins en fait une terre propice à la culture des oranges noscéennes.",81451,False
2162710,4877085,0,0,22,1200,1659,31,81510,81010,"Flotte grise","Alors qu'il allait à la métairie du Coq rouge, un marchand tomba nez à nez avec des Kobolds. Fuyant à toutes jambes, il réussit à leur échapper en se réfugiant en haut d'une cabane. Seul sous la pluie, il resta un long moment à scruter l'horizon.","Les moulins de ce site ont été construits pour moudre le blé et carder la laine produits à la métairie du Coq rouge. Vus de loin, ces bâtiments de pierre dont les ailes proviennent des voiles d'un navire s'apparentent à une imposante armada<Indent/>; d'où leur surnom de “Flotte grise”.",81451,False
2162711,4877087,0,0,52,800,1159,32,81511,81011,"Chute cachée","Fût-ce même pour une jolie danseuse, les regards insistants des hommes sont troublants, mais s'asseoir sous le soleil pour regarder la cascade redonne toujours du courage.","Située à l'estuaire de la rivière d'Agelyss, cette chute donne naissance à un bassin où le seigneur Gegeruju a fait bâtir une cabane sur pilotis pour ses invités de marque. Les danseuses qui travaillent là leur prodigueraient toutes sortes de services spéciaux.",81451,False
2162712,4877088,0,0,22,1800,459,32,81512,81012,"Tour de la Mouette","Les soldats du Maelstrom savent bien qu'il vaut mieux être haut perché pour apercevoir la moindre menace, notamment par mauvais temps.","Cette tour bâtie avec de la roche volcanique typique de la Noscea sert à la fois de phare, indiquant la présence de récifs aux navires, et de poste de guet contre les pirates et les Sahuagins. Son nom vient des nombreuses colonies de mouettes dans les environs.",81451,False
2162713,4877089,0,0,58,1700,1759,33,81514,81014,"Statue de Llymlaen","Lorsque les navires sont chargés et prêts à appareiller, il n'est pas rare de voir les brasseurs locaux venir vénérer la Déesse dans les derniers rayons de soleil.","Dressée au centre de Port-aux-Ales, point de ra<SoftHyphen/>vi<SoftHyphen/>tail<SoftHyphen/>le<SoftHyphen/>ment obligatoire pour les navires au long cours, la statue de Llymlaen, finement ouvragée par un sculpteur roegadyn de renom, est le lieu où les marins viennent prier avant d'embarquer pour le large.",81451,False
2162714,4877090,0,0,22,1800,459,33,81515,81015,"Cimetière de bateaux","Ô vous qui naviguez sur les flots, ne vous laissez pas envoûter par ses mots. Si vous la laissez vous charmer, votre navire finira dans ce charnier. Peu enviable est le destin de ces défunts, qui errent dans le noir au milieu des embruns.","Dans cette crique reposent les épaves des navires qui ont fait naufrage près des côtes noscéennes. Bien qu'ils aient été entraînés par le courant, de nombreux habitants semblent penser qu'ils ont été attirés dans ces lieux par une sirène. La brume persistante et les morts vivants qui errent sur les plages font de ce cimetière l'un des endroits les plus glauques d'Éorzéa.",81451,False
2162715,4877091,0,0,22,800,1159,33,81516,81016,"Camp de la vallée du Crâne","Une pointe de fierté ne fait jamais de mal à un soldat, notamment quand il s'agit de prouver son agilité en grimpant là où on peut bien surveiller l'ennemi.","Tirant son nom de la coutume qu'avaient les soldats d'exposer les crânes d'intrus kobolds pour dissuader leurs camarades de venir plus bas dans la Noscea, cette base militaire du Maelstrom surveille désormais les activités des Sahuagins à Demipierre.",81451,False
2162716,4877092,0,0,22,1200,1659,33,81517,81017,"Barrages du nord et du sud","Semblables en bien des points aux mâts et aux voiles des navires, les tentes des marchands limséens peuvent résister même au poids d'un Roegadyn.","La colonie de Demipierre ayant été envahie par les Sahuagins, ces imposants remparts ont été bâtis afin de contenir les vagues d'assauts de ces hommes-poissons et de les empêcher de déferler dans la vallée du Crâne, ce qui leur vaut le nom de “barrages”.",81451,False
2162717,4877099,0,0,22,1700,1759,34,81518,81018,"Camp du lac d'Airain","Les toits des bâtiments du sanatorium ne sont pas sans rappeler la forme des tonneaux de vin et donnent probablement une belle vue vers le couchant.","Situé près de vestiges de l'ancienne cité de Nym, que la baisse de niveau des eaux du lac d'Airain a révélés, ce camp est célèbre pour son installation du sanatorium du Vin chaud, qui prodigue des soins aux soldats blessés grâce à ces sources thermales.",81451,False
2162718,4877101,0,0,22,1200,1659,34,81519,81019,"Thalaos","Le relief de la Haute-Noscea est pour le moins accidenté, ce qui n'est certainement pas bon pour les vertèbres, mais certains endroits offrent une vue fantastique.","Ce fossile d'un animal préhistorique géant s'est vu donner le nom de Thalaos, un serpent de mer légendaire que la Déesse Lllymlaen aurait libéré autrefois. Ces imposants ossements tendraient à prouver que l'île de Vylbrand était autrefois sous la mer.",81451,False
2162719,4877103,0,0,22,1800,459,34,81520,81020,"Comptoir de Jijiroon","Le lac d'Airain n'est pas sans dangers, surtout la nuit. Heureusement, on peut toujours se percher sur d'anciennes ruines pour échapper aux monstres, mais attention à ne pas glisser.","Ce lieu d'échanges commerciaux est tenu par le Qiqirn Jijiroon, qui entretient une certaine rivalité avec son frère Memeroon, lui-même à la tête d'un éta<SoftHyphen/>blis<SoftHyphen/>se<SoftHyphen/>ment du même genre. Personne ne sait toutefois pourquoi il s'est installé dans un endroit aussi reculé.",81451,False
2162720,4877105,0,0,22,1800,459,350,81521,81021,"Cité flottante de Nym","Les ruines de l'ancienne Nym sont sûrement l'un des panorama les plus impressionnants d'Éorzéa, constellant le ciel de la Noscea.","Ces ruines de l'ancienne cité de Nym, civilisation qui a fleuri sur l'île de Vylbrand à la 5e ère astrale, forment désormais un paysage fantastique du fait de cristaux corrompus, qui renforçant l'élément vent, font flotter une partie des vestiges.",81451,False
2162721,4877106,0,0,22,500,759,350,81522,81022,"Camp du Guet","Les Hirondelles écarlates savent que les buissons qui poussent sur les vieilles pierres nymiennes offrent une cachette idéale pour observer les ennemis.","Ce camp du Maelstrom, établi sur une hauteur de Noscea extérieure afin de mieux observer les mouvements des Kobolds, est la base de l'unité spéciale des Hirondelles écarlates. Au sud, on aperçoit le Palais du Vagabond, ancien édifice nymien dédié au dieu Oschon.",81451,False
2162722,4877107,0,0,22,1200,1659,350,81523,81023,"Mines d'U'Ghamaro","Il faut admettre que les Kobolds ont du talent pour fabriquer des machines aussi hautes, malgré leur corps ratatiné. Leurs longs bras en font peut-être d'excellents escaladeurs.","Près de ce réseau complexe de galeries créé par les Kobolds, le soufre s'est mélangé aux eaux souterraines et usées pour former un paysage unique. Ces hommes-taupes comptent une importante main-d'œuvre qui étend leur territoire in<SoftHyphen/>las<SoftHyphen/>sa<SoftHyphen/>ble<SoftHyphen/>ment.",81451,False
2162723,4877108,0,0,50,1800,459,350,81524,81024,"Masure de l'ermite","L'étrange propriétaire de ces lieux étant continuellement absent, il n'est pas rare d'y voir des personnes entrer dans sa demeure pour s'abriter de la pluie, lire des livres, ou encore regarder les étoiles la nuit venue.","Cette masure isolée jouit d'une vue imprenable sur le volcan d'O'Ghomoro. Située à côté d'une source d'eau chaude, elle s'offre le luxe d'avoir un bain à ciel ouvert sur son terrain. Vagabond dans l'âme, le pro<SoftHyphen/>prié<SoftHyphen/>taire des lieux est une personne mystérieuse dont on ne sait presque rien.",81451,False
2162724,4877111,0,0,22,800,1159,39,81526,81026,"Don de Figaga","La grande roue à eau tourne inlassablement, accueillant et reconduisant tous ceux qui passent par la porte du Blaireau bleu.","Située non loin du café Aux Feuilles de carline, cette imposante roue à aube fournit une énergie précieuse et propre à la guilde des menuisiers. Elle est très appréciée des Gridaniens pour le bruit agréable et apaisant qu'elle produit au contact de l'eau.",81452,False
2162725,4868037,0,0,22,500,759,39,81529,81029,"Guilde des maîtres d'hast","Si la guilde est avant tout un lieu d'entraînement, rien n'empêche les badauds de venir regarder les maîtres manier leurs lances, à condition de rester dans un coin sans les incommoder.","Fondée par le légendaire lancier Mistalle, la guilde des maîtres d'hast sert également de quartier général aux vigiles sombres, l'unité de sécurité publique gridanienne. Ces derniers s'y entraînent d'ailleurs ré<SoftHyphen/>gu<SoftHyphen/>liè<SoftHyphen/>re<SoftHyphen/>ment en compagnie des férus de la lance.",81452,False
2162726,4877112,0,0,22,500,759,54,81531,81031,"Le Bannock","Les officiers gridaniens sont bien placés pour observer les nouvelles recrues s'entraîner, et si jamais certaines se cachent, il suffit de monter un peu plus haut pour les découvrir.","Utilisant ingénieusement la souche d'un arbre géant, que les Gridaniens appellent “pilier céleste”, ce camp a été créé par l'ordre des Deux Vipères pour former ses jeunes recrues. Son nom vient de la ressemblance de cette plateforme avec un pain plat local.",81452,False
2162727,4877113,0,0,22,1800,459,54,81532,81032,"Manoir des Haukke","Les storopers ont beau être des créatures végétales, ils ne savent pas grimper sur les grosses racines... À moins que ce soit la vue du manoir qui leur fasse peur.","Ancienne résidence des Oracles, cette demeure luxueuse a été cédée à la riche famille des Dartancours il y a maintenant deux générations. Le mot “Haukke” désignerait en langue ancienne des rituels de communication silencieuse avec les esprits de la forêt.",81452,False
2162728,4877163,0,0,22,1200,1659,54,81533,81033,"Arbre gardien","Les jours de beau temps, on aperçoit souvent des attroupements de promeneurs observer ce majestueux végétal depuis les hauteurs.","Cet arbre est le plus ancien de la forêt de Sombrelinceul. Âgé de plus de mille ans, ses fruits appelés “prunes millénaires” sont gardés pré<SoftHyphen/>cieu<SoftHyphen/>se<SoftHyphen/>ment par les botanistes du Courtil. D'après les druides gridaniens, il abriterait le doyen des esprits.",81452,False
2162729,4877165,0,0,22,1100,1359,54,81534,81034,"Cascade de l'arc-en-ciel","Lorsque le soleil brille de tous ses rayons, il n'est pas rare de voir des habitants de Gridania s'arrêter sur la passerelle pour observer le spectacle féerique offert par cette chute d'eau.","Cette cascade prend sa source dans la Veine de l'est, l'une des petites rivières qui coulent dans la forêt de Sombrelinceul. En raison de la quantité de gouttelettes qu'elle produit, un arc-en-ciel est la plupart du temps visible quand il fait beau. À son pied se cache une grotte qui permet d'accéder à la Souche de Résurrection.",81452,False
2162730,4878703,0,0,22,1800,459,55,81537,81037,"Le Berceau","S'il y a une lueur d'espoir dans ce monde, c'est bien le fait que, quelle que soit l'espèce, le désir de protéger sa progéniture est le même.","C'est au cœur de ce grand arbre que sont déposées les cosses, c'est-à-dire les cocons contenant les bulbes de Sylphes, pour qu'elles se développent. Ce lieu crucial pour la survie de cette espèce est toujours baigné par la lumière sélénienne des sporelunes.",81452,False
2162731,4878736,0,0,22,800,1159,56,81538,81038,"Au Choix de Buscarron","Si chacun se désaltère librement ici, il est quand même préférable de rester vigilant. Certains imprudents se réveillent parfois frappés par l'orage, après une nuit arrosée.","Ce bar, établi dans la Forêt du sud par un ancien soldat du nom de Buscarron, est un lieu de rendez-vous très apprécié par les aventuriers et les canailles des environs. C'est en quelque sorte un endroit sacré où chacun peut boire en toute tran<SoftHyphen/>quil<SoftHyphen/>li<SoftHyphen/>té.",81452,False
2162732,4878759,0,0,22,800,1159,56,81539,81039,"Aérodrome de la Forêt du sud","Les dirigeants de la société Vols Hautvent ne s'attendaient pas à ce que leur installation tombe entre les mains de bandits sans foi ni loi. C'est d'autant plus regrettable que la vue est exquise depuis la plateforme d'embarquement.","Originairement établi pour le transport de mar<SoftHyphen/>chan<SoftHyphen/>di<SoftHyphen/>ses par la société Vols Hautvent, cet aérodrome a dû fermer en raison des menaces que font peser les Garlemaldais sur les voies aériennes. Cet endroit est aujourd'hui le repaire des Griffecoeurl, qui l'utilisent pour trafiquer fourrures et autres produits braconnés.",81452,False
2162733,4878763,0,0,22,1200,1659,56,81540,81040,"Le Don d'Urth","Certains élémentalistes prétendent que la lumière fantastique de ce lieu sacré est encore plus surnaturelle lorsqu'elle se dissipe dans la brume.","Si l'on en croit les textes sacrés, cette source fortement chargée en éther se situe à l'endroit où la sainte appelée Urth aurait été tuée par Odin, le Chevalier des ombres, ce qui lui vaut son nom actuel. Nul ne sait toutefois si cette légende est vraie.",81452,False
